{
  "dryRunId": "dry-0001",
  "pageNumber": 1,
  "lastPage": true,
  "documents": [
    {
      "entityRef": "ent-001",
      "transactionDate": "2026-08-14",
      "internalTaxCode": "SR-STD",
      "documentFunction": "BILL_FOR_PAYMENT",
      "sgdValuesAbsent": true,
      "taxableValue": "0.00",
      "gstValue": "0.00"
    },
    {
      "entityRef": "ent-001",
      "transactionDate": "2026-08-14",
      "internalTaxCode": "SR-STD",
      "documentFunction": "BILL_FOR_PAYMENT",
      "taxableValue": "1000.00",
      "gstValue": "90.00"
    }
  ]
}
